{
  "$schema": "https://json-schema.org/draft/2020-12/schema",
  "title": "Команда проекта",
  "type": "array",
  "items": {
    "type": "object",
    "required": ["id", "name", "role", "description"],
    "properties": {
      "id": {"type": "string"},
      "name": {"type": "string"},
      "wikidata": {"type": "string", "pattern": "^Q[0-9]+$"},
      "viaf": {"type": "string", "pattern": "^[0-9]+$"},
      "role": {"type": "string"},
      "description": {"type": "string"}
    },
    "additionalProperties": true
  }
}
