[
  {
    "id": "grintser",
    "name": "Павел Александрович Гринцер",
    "wikidata": "Q4149672",
    "viaf": "35823334",
    "role": "Основатель проекта, переводчик (книги I-III)",
    "description": "Выдающийся советский и российский индолог, филолог, исследователь древнеиндийской литературы. Заложил фундамент академического перевода Рамаяны."
  },
  {
    "id": "leonov",
    "name": "Максим Владимирович Леонов",
    "role": "Переводчик (книги V-VI)",
    "description": "Переводчик санскритской литературы, автор опубликованных переводов санскритской поэзии и специалист по передаче поэтической формы оригинала на русском языке."
  },
  {
    "id": "kostina",
    "name": "Екатерина Александровна Костина",
    "role": "Редактор",
    "description": "Исследователь и преподаватель санскрита, хинди и индоарийских языков. Обеспечивает филологическую точность и литературное качество текста."
  },
  {
    "id": "gasuns",
    "name": "Марцис Юрьевич Гасунс",
    "role": "Руководитель проекта, санскритолог",
    "description": "Кандидат филологических наук, отвечает за общее руководство проектом, подготовку указателей и цифровую инфраструктуру."
  }
]
